{
  "schemaVersion": "reader_workspace_snapshot.v1",
  "projectId": "project-empty-1",
  "projectRevision": 0,
  "readMode": "paused",
  "sourceId": "",
  "sourceRevisionId": "",
  "sourceContentHash": "",
  "runId": null,
  "runCompatibilityKey": null,
  "mediaManifestVersion": null,
  "timingRevision": null,
  "syncFidelity": "none",
  "readerLocator": null,
  "playbackCursorMs": null,
  "playbackRate": 1,
  "followPreference": null,
  "updatedAt": "1970-01-01T00:00:00Z"
}
