{
  "schemaVersion": "reader_workspace_snapshot.v1",
  "projectId": "project-reader-1",
  "projectRevision": 4,
  "readMode": "readable",
  "sourceId": "source-book-1",
  "sourceRevisionId": "source-revision-4",
  "sourceContentHash": "sha256:source-revision-4",
  "runId": null,
  "runCompatibilityKey": null,
  "mediaManifestVersion": null,
  "timingRevision": null,
  "syncFidelity": null,
  "readerLocator": null,
  "playbackCursorMs": null,
  "playbackRate": null,
  "followPreference": null,
  "updatedAt": "2026-07-11T10:00:00Z"
}
